{
  "schema_version": 1,
  "status": "partial",
  "sources": [
    "docs/source_archive/canon_sources/active/Pokemon_Fan_Game_354_Move_Catalogue.xlsx",
    "docs/source_archive/canon_sources/active/ABYSSALS_CHECKLIST_12_Learnset_Validation_LOCKED_v1.0.docx"
  ],
  "records": [],
  "unresolved": [
    "Source recovered in Phase A; structured consolidation and exact per-field completeness audit pending Phase E."
  ],
  "expected_count": null
}
