{
  "schema_version": 1,
  "status": "partial",
  "sources": [
    "docs/source_archive/canon_sources/active/ABYSSALS_CHECKLIST_06_Items_Shops_Economy_LOCKED_v1.0.docx"
  ],
  "records": [],
  "unresolved": [
    "Source recovered in Phase A; structured consolidation and exact per-field completeness audit pending Phase E."
  ],
  "expected_count": null
}
