{
  "schema_version": 1,
  "status": "partial",
  "sources": [
    "docs/source_archive/canon_sources/active/Pokemon_Story_Bible_Full_Plot_LOCKED_v1.0.docx",
    "docs/source_archive/canon_sources/active/ABYSSALS_CHECKLIST_10_Story_Event_Flag_Master_List_LOCKED_v1.0.docx"
  ],
  "records": [],
  "unresolved": [
    "Source recovered in Phase A; structured consolidation and exact per-field completeness audit pending Phase E."
  ],
  "expected_count": null
}
